{
  "schema": "product_hash_golden_vectors_v1",
  "version": "1",
  "hashing_config_uri": "fixtures/features/hashing_conformance_config.v1.json",
  "hashing_config_sha256": "27ee2f0a13adf319efd3ff8e6bf17a96970407fa259b2c229a5fba29c0445fd9",
  "algorithm_self_tests": [
    {
      "case_id": "xxh64-empty-seed-zero",
      "input_hex": "",
      "seed_uint64": "0",
      "digest_hex": "ef46db3751d8e999",
      "digest_uint64": "17241709254077376921"
    },
    {
      "case_id": "xxh64-abc-seed-zero",
      "input_hex": "616263",
      "seed_uint64": "0",
      "digest_hex": "44bc2cf5ad770999",
      "digest_uint64": "4952883123889572249"
    }
  ],
  "identity_vectors": [
    {
      "case_id": "rees46-ascii",
      "namespace": "rees46:item",
      "identifier": "44600062",
      "serialized_hex": "0000000b7265657334363a6974656d000000083434363030303632",
      "digest_hex": "7e7d08c33a361181",
      "digest_uint64": "9114450855456018817",
      "bucket_index": 5
    },
    {
      "case_id": "same-id-other-namespace",
      "namespace": "catalog-b:item",
      "identifier": "44600062",
      "serialized_hex": "0000000e636174616c6f672d623a6974656d000000083434363030303632",
      "digest_hex": "0775b84b98888b26",
      "digest_uint64": "537538365361785638",
      "bucket_index": 6
    },
    {
      "case_id": "unicode-byte-length",
      "namespace": "münchen:item",
      "identifier": "商品-١٢٣",
      "serialized_hex": "0000000d6dc3bc6e6368656e3a6974656d0000000de59586e593812dd9a1d9a2d9a3",
      "digest_hex": "cc18346f0bdff8b2",
      "digest_uint64": "14706562234723596466",
      "bucket_index": 14
    },
    {
      "case_id": "numeric-string-beyond-uint64",
      "namespace": "rees46:item",
      "identifier": "18446744073709551616000000000000000000",
      "serialized_hex": "0000000b7265657334363a6974656d000000263138343436373434303733373039353531363136303030303030303030303030303030303030",
      "digest_hex": "2e54db989ea66430",
      "digest_uint64": "3338534672331596848",
      "bucket_index": 14
    },
    {
      "case_id": "unicode-nfc-preserved",
      "namespace": "test:item",
      "identifier": "café",
      "serialized_hex": "00000009746573743a6974656d00000005636166c3a9",
      "digest_hex": "50d0a45988f77a99",
      "digest_uint64": "5823335022647016089",
      "bucket_index": 7
    },
    {
      "case_id": "unicode-nfd-preserved",
      "namespace": "test:item",
      "identifier": "café",
      "serialized_hex": "00000009746573743a6974656d0000000663616665cc81",
      "digest_hex": "e54cb00776991b6d",
      "digest_uint64": "16522774679016512365",
      "bucket_index": 13
    },
    {
      "case_id": "length-prefix-ab-c",
      "namespace": "ab",
      "identifier": "c",
      "serialized_hex": "0000000261620000000163",
      "digest_hex": "814484839e66d557",
      "digest_uint64": "9314715630142149975",
      "bucket_index": 15
    },
    {
      "case_id": "length-prefix-a-bc",
      "namespace": "a",
      "identifier": "bc",
      "serialized_hex": "0000000161000000026263",
      "digest_hex": "575a694e253bd726",
      "digest_uint64": "6294459213556733734",
      "bucket_index": 6
    }
  ],
  "reserved_vectors": [
    {
      "case_id": "reserved-pad",
      "input_kind": "PAD",
      "hash_applied": false,
      "bucket_index": 0
    },
    {
      "case_id": "reserved-oov",
      "input_kind": "OOV",
      "hash_applied": false,
      "bucket_index": 3
    },
    {
      "case_id": "reserved-null",
      "input_kind": "NULL",
      "hash_applied": false,
      "bucket_index": 16
    }
  ],
  "known_bad": [
    {
      "case_id": "implicit-null-serialization",
      "operation": "serialize-null",
      "error_code": "INVALID_IDENTITY_TYPE"
    },
    {
      "case_id": "empty-namespace",
      "operation": "serialize-empty-namespace",
      "error_code": "EMPTY_NAMESPACE"
    },
    {
      "case_id": "empty-identifier",
      "operation": "serialize-empty-identifier",
      "error_code": "EMPTY_IDENTIFIER"
    },
    {
      "case_id": "integer-identifier",
      "operation": "construct-integer-identifier",
      "error_code": "INVALID_IDENTIFIER_TYPE"
    },
    {
      "case_id": "no-usable-bucket",
      "operation": "load-config-no-usable-bucket",
      "error_code": "NO_USABLE_BUCKET"
    },
    {
      "case_id": "duplicate-reserved-index",
      "operation": "load-config-duplicate-reserved-index",
      "error_code": "DUPLICATE_RESERVED_INDEX"
    },
    {
      "case_id": "config-hash-mismatch",
      "operation": "load-config-hash-mismatch",
      "error_code": "CONFIG_HASH_MISMATCH"
    }
  ]
}
